tweet_id	text	created_at	retweet_count	user_id	screen_name	#followers	#followings	#statuses	keywords	hashtags	urls
519111588562079745	At Boots in Nottm to welcome 3 new start ups to MediCity. Gov investment in Enterprise Zone supporting flourishing future economy here	2014-10-06 13:07:02	12	1225696320	George Osborne	188335	123	2713	[]	[]	[]
518003230887124992	Introduced @Mindcharity #TimetoChange campaign @HM Treasury -delighted we’re donating up to £4m #Libor funds to them: http://t.co/fXFr8GxTub	2014-10-03 11:42:48	19	1225696320	George Osborne	188335	123	2713	[]	['TimetoChange', 'Libor']	['http://www.mind.org.uk/news-campaigns/campaigns/time-to-change/']
518002468505260033	Up to £4m of #libor fines going to @Mindcharity, providing mental health support for emergency services personnel: http://t.co/rCjOEBfV1t	2014-10-03 11:39:47	17	1225696320	George Osborne	188335	123	2713	[]	['libor']	['http://www.mind.org.uk/']
518002147083182081	£10m of #libor fines from those who’ve demonstrated the worst values are going to our emergency services, who demonstrate the best values	2014-10-03 11:38:30	61	1225696320	George Osborne	188335	123	2713	[]	['libor']	[]
517700952661716992	Virgin Money’s announcement that it will float means taxpayers set to recover over £1bn from sale of Northern Rock #LongTermEconomicPlan	2014-10-02 15:41:40	51	1225696320	George Osborne	188335	123	2713	[]	['LongTermEconomicPlan']	[]
517305096624160769	Minimum wage up to £6.50 today. First real terms increase since Labour's Great Recession. Only a stronger economy makes this possible	2014-10-01 13:28:40	127	1225696320	George Osborne	188335	123	2713	[]	[]	[]
517286520269860864	After conferences- choice at election: leadership &amp; economic plan with David Cameron. No leadership &amp; no plan with Miliband. Future not past	2014-10-01 12:14:51	68	1225696320	George Osborne	188335	123	2713	[]	[]	[]
517284481397694464	Our #LongTermEconomicPlan now includes pledge to raise personal allowance to £12,500 and 40p threshold to £50,000 by 2020.	2014-10-01 12:06:45	101	1225696320	George Osborne	188335	123	2713	[]	['LongTermEconomicPlan']	[]
517282904532328448	Best speech PM's given. Spelt out clear plan for next 5 years. Contrast with last week couldn't be starker	2014-10-01 12:00:29	119	1225696320	George Osborne	188335	123	2713	[]	[]	[]
516957077940731905	Great to announce with PM HS2 Skills College here in Birmingham -will train thousands of apprentices we'll need to build UK's future economy	2014-09-30 14:25:46	21	1225696320	George Osborne	188335	123	2713	[]	[]	[]
516951484714733568	At Birmingham New St with @David_Cameron &amp; apprentices working on the amazing new station that is part of #LongTermEconomicPlan	2014-09-30 14:03:33	16	1225696320	George Osborne	188335	123	2713	[]	['LongTermEconomicPlan']	[]
516878587123990528	Real household disposable income rose by 2.2% in 2nd Quarter. Much more to do, but shows the link between economy &amp; prosperity	2014-09-30 09:13:52	44	1225696320	George Osborne	188335	123	2713	[]	[]	[]
516873877499441152	Good economic news today. GDP in Q2 revised up to 0.9%; biz investment up 11%. More evidence that tackling our problems head on works	2014-09-30 08:55:10	50	1225696320	George Osborne	188335	123	2713	[]	[]	[]
516617024689430528	We want low taxes but taxes that are paid. Some tech multinationals divert profits offshore to avoid tax.We'll stop that at Autumn Statement	2014-09-29 15:54:31	44	1225696320	George Osborne	188335	123	2713	[]	[]	[]
516605686026092544	Have taken difficult decision to freeze working age benefits for 2 years to help Britain deal with our debts and secure the recovery	2014-09-29 15:09:28	40	1225696320	George Osborne	188335	123	2713	[]	[]	[]
516604939993628672	In speech to Conservative conference I talked about the big choice on the economy &amp; the choice now facing Britain. Let's choose the future	2014-09-29 15:06:30	44	1225696320	George Osborne	188335	123	2713	[]	[]	[]
516521533196730370	Just been to thriving Jaguar Land Rover plant in Solihull. The future of the economy is at the core of the choice facing Britain	2014-09-29 09:35:04	34	1225696320	George Osborne	188335	123	2713	[]	[]	[]
516507238429896704	Next stage in pension reforms is abolishing death tax on pensions so people who've worked hard &amp; saved can pass their pension on tax free	2014-09-29 08:38:16	70	1225696320	George Osborne	188335	123	2713	['people']	[]	[]
516147430644269056	We should abolish long term youth unemployment. We'll spend less on benefits &amp; more on helping young people get jobs	2014-09-28 08:48:31	85	1225696320	George Osborne	188335	123	2713	['people']	[]	[]
516147121696034816	We've seen record falls in youth unemployment. But still too high. So we're creating 3m apprenticeships, investing in young people’s future	2014-09-28 08:47:18	84	1225696320	George Osborne	188335	123	2713	['people']	[]	[]
515085407068127232	Financial markets should work for everyone so today we’re taking further action to stamp out market abuse https://t.co/0fevCBr94V	2014-09-25 10:28:25	15	1225696320	George Osborne	188335	123	2713	[]	[]	['https://www.gov.uk/government/news/government-consults-on-extending-libor-powers-to-more-financial-benchmarks']
514426118875910144	Ed Miliband didn't mention the deficit once. Extraordinary. If you can't fix the economy you can't fund the NHS	2014-09-23 14:48:38	515	1225696320	George Osborne	188335	123	2713	[]	[]	[]
514094593458331648	Thanks for powerful petition to no11 today on tax transparency by @OneCampaign. UK leading way in G20 - I promise to keep up pressure	2014-09-22 16:51:17	42	1225696320	George Osborne	188335	123	2713	[]	[]	[]
512157122537459712	Unemployment in Scotland is down to 6% - below UK average. Scotland doing well as part of UK #BetterTogether	2014-09-17 08:32:28	160	1225696320	George Osborne	188335	123	2713	[]	['BetterTogether']	[]
512156798502330368	Today's employment stats mark another step towards full employment. But still much more to do. Will set out further plans this autumn	2014-09-17 08:31:10	38	1225696320	George Osborne	188335	123	2713	[]	[]	[]
512156654952267776	New unemployment stats show claimant count fallen to under 1 million for 1st time since Great Recession. #LongTermEconomicPlan is working	2014-09-17 08:30:36	67	1225696320	George Osborne	188335	123	2713	[]	['LongTermEconomicPlan']	[]
512153312532389888	An honour to welcome home 1st Battalion Coldstream Guards &amp; delighted to wave off their Bike2Bennecourt charity ride http://t.co/LGx9Mci26x	2014-09-17 08:17:19	14	1225696320	George Osborne	188335	123	2713	[]	[]	[]
511862399180496896	New QS rankings show 4 of world's top 6 universities are in UK. A great result &amp; another reason to be optimistic about UK's economic future	2014-09-16 13:01:20	64	1225696320	George Osborne	188335	123	2713	[]	[]	[]
511814020807282689	Good news inflation has fallen again to just 1.5%, below the 2% target. But people still feeling impact of the Great Recession so more to do	2014-09-16 09:49:06	55	1225696320	George Osborne	188335	123	2713	['people']	[]	[]
510789255040614400	At ECOFIN in Italy. Strong UK economic performance stands out but worries about eurozone + Scottish separation. #BetterTogether	2014-09-13 13:57:03	10	1225696320	George Osborne	188335	123	2713	[]	['BetterTogether']	[]
510428414114017280	The £2.4bn of new #UKChina business deals we've announced today are only possible because of the economic clout of whole United Kingdom	2014-09-12 14:03:11	53	1225696320	George Osborne	188335	123	2713	[]	['UKChina']	[]
510427699845013504	Delighted to announce funding to translate the complete works of Shakespeare into Chinese with @theRSC set to tour in China	2014-09-12 14:00:21	27	1225696320	George Osborne	188335	123	2713	[]	[]	[]
510427502301687808	Great to see new direct #UKChina flight from Manchester to Beijing by China Hainan Airlines. Another step in creating a #NorthernPowerhouse	2014-09-12 13:59:34	22	1225696320	George Osborne	188335	123	2713	[]	['UKChina', 'NorthernPowerhouse']	[]
510426495559675904	We're seizing the opportunity to be the first major foreign government to issue a bond in China’s currency. #UKChina	2014-09-12 13:55:34	43	1225696320	George Osborne	188335	123	2713	[]	['UKChina']	[]
510421706704683008	Today marks 6th Economic &amp; Financial Dialogue between #UKChina– strengthening ties with China is a key part of our #LongTermEcononicPlan	2014-09-12 13:36:32	8	1225696320	George Osborne	188335	123	2713	[]	['UKChina', 'LongTermEcononicPlan']	[]
510364935768272896	The winning design will be in millions of people’s pockets. Heads you win; tails, it’s your design. It’s #yourpoundcoin	2014-09-12 09:50:57	13	1225696320	George Osborne	188335	123	2713	['people']	['yourpoundcoin']	[]
510364744432500736	What would you put on #yourpoundcoin? A favourite UK landmark? A great British achievement? Or a symbol from our Islands’ story?	2014-09-12 09:50:11	26	1225696320	George Osborne	188335	123	2713	[]	['yourpoundcoin']	[]
510364491193008128	I'm launching a competition today to design the new £1 coin. #yourpoundcoin Take part here: http://t.co/BtRPgK0q5O	2014-09-12 09:49:11	97	1225696320	George Osborne	188335	123	2713	[]	['yourpoundcoin']	['http://www.royalmint.com/newonepoundcoin']
510150026740629504	94% of @HelptoBuy homes are outside London, with the highest number in Bedford, Chorley and Kingston-upon-Hull	2014-09-11 19:36:59	35	1225696320	George Osborne	188335	123	2713	[]	[]	[]
510149886965456896	We’ve published postcode data for @HelptoBuy, showing that top 10 hotspots are spread across the country: http://t.co/IFMy2Xdv1E	2014-09-11 19:36:25	15	1225696320	George Osborne	188335	123	2713	[]	[]	['http://opendatacommunities.org/def/concept/folders/themes/housing-market']
509709738385612800	Asked @uksciencechief how to put science at heart of #NorthernPowerhouse. Hearing his plan for National Institute for Materials Research	2014-09-10 14:27:26	7	1225696320	George Osborne	188335	123	2713	[]	['NorthernPowerhouse']	[]
509709540049551360	Hosting meeting  in Manchester with northern leaders, UK chief scientist &amp; academics. We're working together to create a #NorthernPowerhouse	2014-09-10 14:26:38	17	1225696320	George Osborne	188335	123	2713	[]	['NorthernPowerhouse']	[]
509694841610330112	Graphene tech is a game changer – 200 times stronger than steel but hugely flexible. Lots of opportunities for jobs as UK is world leader	2014-09-10 13:28:14	19	1225696320	George Osborne	188335	123	2713	[]	[]	[]
509694439661764608	With Prof Kostya Novoselov who won Nobel Prize for Graphene. We've worked together for 3yrs to ensure Discovered In UK leads to Made in UK	2014-09-10 13:26:38	13	1225696320	George Osborne	188335	123	2713	[]	[]	[]
509694241841623041	At Manchester Uni to announce new £60m Graphene Engineering Innovation Centre.Investment from Abu Dhabi+gov funding into #NorthernPowerhouse	2014-09-10 13:25:51	18	1225696320	George Osborne	188335	123	2713	[]	['NorthernPowerhouse']	[]
509680238696349696	City Labs is exciting project that joins up scientists with clinicians &amp; industry -exactly kind of partnerships we need #NorthernPowerhouse	2014-09-10 12:30:12	8	1225696320	George Osborne	188335	123	2713	[]	['NorthernPowerhouse']	[]
509680074850074624	Pleased to be opening City Labs, a biomedical centre of excellence in Manchester- driving innovation &amp; investment in health sciences	2014-09-10 12:29:33	17	1225696320	George Osborne	188335	123	2713	[]	[]	[]
509663486079930368	At Capenhurst Nuclear Services in Chester with MP @stephen_mosley to see how UK biz lead world in decommissioning technology	2014-09-10 11:23:38	9	1225696320	George Osborne	188335	123	2713	[]	[]	[]
509662935372029952	In North West to set out next steps in building #NorthernPowerhouse. Today am focussing on how science must be at heart of future UK economy	2014-09-10 11:21:27	22	1225696320	George Osborne	188335	123	2713	[]	['NorthernPowerhouse']	[]
509660938962993152	Financial services huge employer in Scotland. Now we have UK Commissioner for this key industry -Great example of how we're #BetterTogether	2014-09-10 11:13:31	47	1225696320	George Osborne	188335	123	2713	[]	['BetterTogether']	[]
509649341154619393	Look forward to working with Lord Hill, EU financial services Commissioner, to build safer &amp; more competitive sector. Great news for UK	2014-09-10 10:27:26	41	1225696320	George Osborne	188335	123	2713	[]	[]	[]
507550015037145088	Making UK world leader in science &amp; innovation is key part of #LongTermEconomicPlan, new @TeachFirst partnership will help deliver this	2014-09-04 15:25:28	11	1225696320	George Osborne	188335	123	2713	[]	['LongTermEconomicPlan']	[]
507549795020734464	At @RollsRoyce Derby on #GreatBritishBrands tour. Here to launch their @TeachFirst partnership supporting 10,000 students in science &amp; maths	2014-09-04 15:24:35	19	1225696320	George Osborne	188335	123	2713	[]	['GreatBritishBrands']	[]
507509925464272896	Met with our strong candidate for Cannock @Amandamilling to discuss what together we can do to bring more jobs to her local area	2014-09-04 12:46:09	7	1225696320	George Osborne	188335	123	2713	[]	[]	[]
507509705401700352	Team @Screwfix have given me my own personal high viz and hard hat. Now I'm fully equipped for the tours ahead http://t.co/kbSq7Gwzfu	2014-09-04 12:45:17	24	1225696320	George Osborne	188335	123	2713	[]	[]	[]
507501583660511233	Store manager Jackie &amp; team @Screwfix say they see growth in W.Mids firsthand - literally providing tools to the people building our economy	2014-09-04 12:13:01	8	1225696320	George Osborne	188335	123	2713	['people']	[]	[]
507501300234616832	In Cannock @Screwfix as part of #GreatBritishBrands tour. Fantastic to see this UK success story announcing 900 jobs in 50 new stores today	2014-09-04 12:11:53	11	1225696320	George Osborne	188335	123	2713	[]	['GreatBritishBrands']	[]
507467152795140096	With our strong candidate for Corby Tom Pursglove hearing how local Conservatives helping secure 2000 new jobs at Skew Bridge development	2014-09-04 09:56:12	10	1225696320	George Osborne	188335	123	2713	[]	[]	[]
507466773894275072	Getting Britain exporting is key to our #LongTermEcononicPlan. Great to see iconic brand @Weetabix helping Britain earn its way in world	2014-09-04 09:54:41	7	1225696320	George Osborne	188335	123	2713	[]	['LongTermEcononicPlan']	[]
507466349749501952	Am @Weetabix in Corby kicking off #GreatBritishBrands tour.Firm's launching green tea Alpen Bar exclusively for China http://t.co/RS6tBPaynU	2014-09-04 09:53:00	25	1225696320	George Osborne	188335	123	2713	[]	['GreatBritishBrands']	[]
507085871238373376	GDP revisions show by tackling our problems head on we're building a stronger economy. Risks remain – we need to keep working through plan	2014-09-03 08:41:07	22	1225696320	George Osborne	188335	123	2713	[]	[]	[]
507085554648109056	Double dose of good economic news: UK economy climbs global rankings &amp; new GDP data revise growth higher #LongTermEconomicPlan is working	2014-09-03 08:39:52	46	1225696320	George Osborne	188335	123	2713	[]	['LongTermEconomicPlan']	[]
507085345629163520	Good news: UK GDP growth in 2011 &amp; 2012 revised up –UK has now grown 8.1% under this Government, up from 7.0% &amp; faster than France &amp; Germany	2014-09-03 08:39:02	58	1225696320	George Osborne	188335	123	2713	[]	[]	[]
507081669413974017	The @WEF Global Competitiveness report upgrades UK with direct link from our credible fiscal policy to attracting business &amp; jobs	2014-09-03 08:24:25	20	1225696320	George Osborne	188335	123	2713	[]	[]	[]
506731112404901888	94% of #HelptoBuy completions have taken place outside of London – we’re helping people across the UK get on to the property ladder	2014-09-02 09:11:26	33	1225696320	George Osborne	188335	123	2713	['people']	['HelptoBuy']	[]
506729154520563712	Great news that over 48,000 people have bought a home through #HelptoBuy http://t.co/w2xpwgh2zq	2014-09-02 09:03:39	37	1225696320	George Osborne	188335	123	2713	['people']	['HelptoBuy']	[]
506728924760801280	New data released today on #HelptoBuy shows scheme overwhelmingly supports first time buyers http://t.co/oTJj12YImk	2014-09-02 09:02:44	20	1225696320	George Osborne	188335	123	2713	[]	['HelptoBuy']	[]
505331163565928448	With @AmberRuddMP &amp; local biz in Hastings to hear about dramatic fall in unemployment &amp; what more our #LongTermEcononicPlan can do for town	2014-08-29 12:28:32	11	1225696320	George Osborne	188335	123	2713	[]	['LongTermEcononicPlan']	[]
505288362572673024	In Hove with our strong candidate @CoxGraham to see growing biz @SouthernUniLtd. Great firm now hiring new staff &amp; apprentices	2014-08-29 09:38:28	26	1225696320	George Osborne	188335	123	2713	[]	[]	[]
505270710500327424	Tom Stoppard says today that new touring production of Arcadia has been directly helped by the new tax relief	2014-08-29 08:28:19	5	1225696320	George Osborne	188335	123	2713	[]	[]	[]
505270499086458880	http://t.co/TxT53sRPid	2014-08-29 08:27:29	12	1225696320	George Osborne	188335	123	2713	[]	[]	[]
505265906000609280	http://t.co/kD5AXwODaL	2014-08-29 08:09:14	35	1225696320	George Osborne	188335	123	2713	[]	[]	[]
505265111519756288	At @TheatreRoyalBrighton with @SimonKirbyMP this morning to launch our new theatre tax relief to support arts in the regions	2014-08-29 08:06:04	24	1225696320	George Osborne	188335	123	2713	[]	[]	[]
501724003036196864	Welcome news for family budgets that inflation has fallen to just 1.6% #longtermeconomicplan	2014-08-19 13:34:58	40	1225696320	George Osborne	188335	123	2713	[]	['longtermeconomicplan']	[]
500277161790808064	Good news UK growth revised up to 3.2% over year,fastest in G7. But risks from weak eurozone shows why must work thru #longtermeconomicplan	2014-08-15 13:45:44	47	1225696320	George Osborne	188335	123	2713	[]	['longtermeconomicplan']	[]
499571008790331392	Youth unemployment fallen at fastest rate on record+unemployment at 6yr low. Every job is a family more secure with a brighter future	2014-08-13 14:59:44	67	1225696320	George Osborne	188335	123	2713	[]	[]	[]
497721990107914240	Top film&amp;TV biz @Lionsgate relocating international sales HQ to http://t.co/U6dkWHE59Q for creative industries part of #longtermeconomicplan	2014-08-08 12:32:24	16	1225696320	George Osborne	188335	123	2713	[]	['longtermeconomicplan']	['http://UK.Support']
496684102096269313	Am announcing 7 new University Technical Colleges + 4 studio schools. 5000 young people will get skills they need. #longtermeconomicplan	2014-08-05 15:48:12	29	1225696320	George Osborne	188335	123	2713	['people']	['longtermeconomicplan']	[]
496656333962498048	At Arville Textiles,Wetherby with @AlecShelbrooke + apprentices. Growing biz and supporter of #NorthernPowerhouse http://t.co/LU82NJq0yi	2014-08-05 13:57:52	16	1225696320	George Osborne	188335	123	2713	[]	['NorthernPowerhouse']	[]
496625004943921152	On M1Jcts 39-40 to see investment in transport infrastructure. Projects like this help build #NorthernPowerhouse http://t.co/JMW2Qcl0x2	2014-08-05 11:53:22	20	1225696320	George Osborne	188335	123	2713	[]	['NorthernPowerhouse']	[]
496600051318546432	Speaking alongside leaders of Manchester, Liverpool and Leeds. Working together on pathway to #NorthernPowerhouse http://t.co/Rjmoznsvbc	2014-08-05 10:14:13	20	1225696320	George Osborne	188335	123	2713	[]	['NorthernPowerhouse']	[]
496550739154845696	I'll be on @BBCr4today shortly with @EvanHD setting out our plans for the pathway to the #NorthernPowerhouse	2014-08-05 06:58:16	14	1225696320	George Osborne	188335	123	2713	[]	['NorthernPowerhouse']	[]
496547205478907904	Good to be in Manchester today to welcome One North report from 5 northern cities - together we can build #NorthernPowerhouse	2014-08-05 06:44:13	41	1225696320	George Osborne	188335	123	2713	[]	['NorthernPowerhouse']	[]
496283889200291840	Have been meeting apprentices learning carpentry and masonry skills at Dumfries House,East Ayrshire. Visionary project well worth visiting	2014-08-04 13:17:54	6	1225696320	George Osborne	188335	123	2713	[]	[]	[]
496281516557991936	See my FT article on unsung role of Treasury officials in avoiding financial crash on eve of #WW1 and financing war. http://t.co/zxeuSxtJf0	2014-08-04 13:08:28	3	1225696320	George Osborne	188335	123	2713	[]	['WW1']	['http://www.ft.com/cms/s/0/e3a3ae92-198d-11e4-8730-00144feabdc0.html?siteedition=uk#axzz39PD0CI9k']
496241842200252416	Very moving service at Glasgow Cathedral to commemorate #WW1. A poignant reflection on the enormous courage and sacrifice.	2014-08-04 10:30:49	23	1225696320	George Osborne	188335	123	2713	[]	['WW1']	[]
496193243844186112	In Glasgow to attend Commonwealth commemoration of start of First World War. Solemn moment to reflect on sacrifice of a generation	2014-08-04 07:17:42	15	1225696320	George Osborne	188335	123	2713	[]	[]	[]
493791030349942785	Floral displays put up by Knutsford shops still looking spectacular even after RHS Tatton Flower show has left town	2014-07-28 16:12:10	22	1225696320	George Osborne	188335	123	2713	[]	[]	[]
493453712132956161	Just seen wonderful production of Dvorak's The Jacobin on last day of great @BuxtonFestival. Congrats to all involved.	2014-07-27 17:51:47	22	1225696320	George Osborne	188335	123	2713	[]	[]	[]
492646177624846336	Announcing Halton residents will have free use of new Mersey Gateway Bridge &amp; Silver Jubilee Bridge-saving commuters up to £300 per year	2014-07-25 12:22:56	32	1225696320	George Osborne	188335	123	2713	[]	[]	[]
492645996657397760	I'm with @GrahamEvansMP at site of the Mersey Gateway Bridge we're building to see work begin at Wigg Island Runcorn	2014-07-25 12:22:13	13	1225696320	George Osborne	188335	123	2713	[]	[]	[]
492613051917799424	Been doing i/vs re latest GDP figures &amp; the economy with @EdConwaySky @Channel4News's Gary Gibbon, @DuncanWeldon @ITVJoel &amp; @peterlane5news	2014-07-25 10:11:18	15	1225696320	George Osborne	188335	123	2713	[]	[]	[]
492603994142146560	Key part of our long term plan is to increase banking competition. Great to see @VirginMoney growing &amp; creating more jobs here in North East	2014-07-25 09:35:19	15	1225696320	George Osborne	188335	123	2713	[]	[]	[]
492592783598043136	Been to @VirginMoney branch on Northumberland st- formerly Northern Rock - to meet staff who were here in 2007 http://t.co/tQdgeNVHUh	2014-07-25 08:50:46	7	1225696320	George Osborne	188335	123	2713	[]	[]	[]
492590425178648576	Visiting @VirginMoney Newcastle, home to Northern Rock where crisis started. Now as economy passes pre-crisis peak they're creating 200 jobs	2014-07-25 08:41:23	18	1225696320	George Osborne	188335	123	2713	[]	[]	[]
492588016033357827	We owe it to hardworking taxpayers not to repeat the mistakes of the past &amp;instead work through the plan that's delivering economic security	2014-07-25 08:31:49	48	1225696320	George Osborne	188335	123	2713	[]	[]	[]
492587810013339648	Economy bigger than previous peak in 2008 but long way to go-the Great Recession was one of deepest of any major economy &amp; cost UK 6 years	2014-07-25 08:31:00	66	1225696320	George Osborne	188335	123	2713	[]	[]	[]
492587694472843264	Economy grew by 0.8%. Thanks to the hard work of the British people, today we reach a major milestone in our #LongTermEconomicPlan	2014-07-25 08:30:32	77	1225696320	George Osborne	188335	123	2713	['people']	['LongTermEconomicPlan']	[]
492331185314746368	With local MP @jameswhartonmp meeting staff at Carroll &amp; Meynell transformers http://t.co/ZJSSCgHGVg	2014-07-24 15:31:16	11	1225696320	George Osborne	188335	123	2713	[]	[]	[]
492326912577253376	Visiting another British success story in Stockton. Carroll &amp; Meynell has doubled sales and number of employees since 2010	2014-07-24 15:14:17	6	1225696320	George Osborne	188335	123	2713	[]	[]	[]
492323877243326465	We need to go on working through the plan - backing business, rebalancing the economy &amp; securing a brighter economic future for Britain	2014-07-24 15:02:13	19	1225696320	George Osborne	188335	123	2713	[]	[]	[]
492323515656572928	IMF upgrades UK growth by more than any other major economy. Further evidence that our #LongTermEconomicPlan is working	2014-07-24 15:00:47	78	1225696320	George Osborne	188335	123	2713	[]	['LongTermEconomicPlan']	[]
492288160429531137	Key part of #LongTermEconomicPlan is making UK a world leader in science. New RB Centre of Scientific Excellence will help deliver this	2014-07-24 12:40:18	11	1225696320	George Osborne	188335	123	2713	[]	['LongTermEconomicPlan']	[]
492287415407894528	RB is great British success story &amp; today’s investment will create new jobs &amp; secure over 1200 existing jobs. #LongTermEconomicPlan working	2014-07-24 12:37:20	11	1225696320	George Osborne	188335	123	2713	[]	['LongTermEconomicPlan']	[]
492284397618724865	Good to be at RB plc in Hull to welcome £100m investment to create state of the art Centre of Scientific Excellence in North of England	2014-07-24 12:25:21	14	1225696320	George Osborne	188335	123	2713	[]	[]	[]
492275651391799296	@LSEplc	2014-07-24 11:50:35	0	1225696320	George Osborne	188335	123	2713	[]	[]	[]
492275328015151104	Great that DJI Holdings from Cheshire listing on @LSEplc -our tax changes help exciting local firms to list &amp; get finance they need to grow	2014-07-24 11:49:18	20	1225696320	George Osborne	188335	123	2713	[]	[]	[]
491646644182863873	1st direct flight from China outside London landed today at Birmingham Airport, further strengthening UK-China links across whole country	2014-07-22 18:11:08	50	1225696320	George Osborne	188335	123	2713	[]	[]	[]
491585049532575744	Hugely enjoyed speaking in the beautiful Bute Hall at the University of Glasgow this afternoon http://t.co/Al7H0ZmK5A	2014-07-22 14:06:23	11	1225696320	George Osborne	188335	123	2713	[]	[]	[]
