tweet_id	text	created_at	retweet_count	user_id	screen_name	#followers	#followings	#statuses	keywords	hashtags	urls
584987066456530944	Pension freedoms achieved by abolishing punitive 55% tax. Conservative principles in action: cut taxes + trust people with their own money	2015-04-06 07:52:39	60	1225696320	George Osborne	188335	123	2713	['people']	[]	[]
584986953759731712	Today is #pensionfreedomsday - we're giving people who've worked hard and saved hard access to their own pension savings	2015-04-06 07:52:12	53	1225696320	George Osborne	188335	123	2713	['people']	['pensionfreedomsday']	[]
584674819096113152	Lovely Easter morning in garden centre @wyevaleGC discussing #pensionfreedomsday with local residents http://t.co/1SbP1GJuTG	2015-04-05 11:11:54	11	1225696320	George Osborne	188335	123	2713	[]	['pensionfreedomsday']	[]
584674566502514688	I urge people approaching retirement to see how new unprecedented pension freedoms can benefit them &amp; use free PensionWise guidance service	2015-04-05 11:10:54	33	1225696320	George Osborne	188335	123	2713	['people']	[]	[]
584671910123982848	With fantastic Brentford and Isleworth Conservative Candidate @marymacleod4MP at @wyevaleGC http://t.co/isZdsAI2F9	2015-04-05 11:00:20	25	1225696320	George Osborne	188335	123	2713	[]	[]	[]
584671897050316800	Tomorrow is pension freedoms day - a revolution which will enable millions who've worked and saved hard to access their savings.	2015-04-05 11:00:17	56	1225696320	George Osborne	188335	123	2713	[]	[]	[]
584649274681593856	About to do interview on @MurnaghamSky from Isleworth talking about the new pension freedoms that come in tomorrow	2015-04-05 09:30:23	11	1225696320	George Osborne	188335	123	2713	[]	[]	[]
583996701851123712	#HelptoBuy helped Craig buy new home in Colchester.Thanks for inviting great candidate @willquince &amp; me in for tea http://t.co/Nja0PQiI1e	2015-04-03 14:17:18	53	1225696320	George Osborne	188335	123	2713	[]	['HelptoBuy']	[]
583988654361698304	Visiting Rosewood development in Colchester with @willquince. 45% of people here used #HelptoBuy for their brand new @CrestNicholson homes	2015-04-03 13:45:19	24	1225696320	George Osborne	188335	123	2713	['people']	['HelptoBuy']	[]
583961521224556544	Viewing Charlotte and Christian's new @Helptobuy home in Clipstone, Nottinghamshire http://t.co/u6qVB6dnKS	2015-04-03 11:57:30	18	1225696320	George Osborne	188335	123	2713	[]	[]	[]
583961241774882816	Fantastic to see development of a policy we worked on in Treasury turn into the reality of bricks, mortar and a home for a family #HelptoBuy	2015-04-03 11:56:24	34	1225696320	George Osborne	188335	123	2713	[]	['HelptoBuy']	[]
583957601991467009	Great to meet Charlotte and Christian with @Mark_Spencer @Sherwood_Cons - about to get brand new home through @HelptoBuy	2015-04-03 11:41:56	15	1225696320	George Osborne	188335	123	2713	[]	[]	[]
583956498390376448	News today 50,000+ people registered interest in our new Starter Homes-great initiative offering 20% off new homes for young 1st time buyers	2015-04-03 11:37:33	54	1225696320	George Osborne	188335	123	2713	['people']	[]	[]
583956253241671680	Great @TaylorWimpey creating 100 new apprenticeships this year. Gov backing for housebuilding is key part of our plan for next parliament	2015-04-03 11:36:34	41	1225696320	George Osborne	188335	123	2713	[]	[]	[]
583740477872218112	David Cameron was in charge from beginning to end. The debate on who would make best Prime Minister for Britain has been settled	2015-04-02 21:19:09	299	1225696320	George Osborne	188335	123	2713	[]	[]	[]
583721675105112064	Very strong performance by PM in #leadersdebate. Showing strong leadership v chaos of others. Miliband exposed on economy, faltering on NHS	2015-04-02 20:04:27	217	1225696320	George Osborne	188335	123	2713	[]	['leadersdebate']	[]
583605845805703169	Cancelling £21 bn investment would be a disaster for the North. Ed Balls should reverse. Let's stick to plan that's closing north/south gap	2015-04-02 12:24:11	78	1225696320	George Osborne	188335	123	2713	[]	[]	[]
583605435300782080	Ed Balls threatening to put jobs + investment in Yorkshire and #Northernpowerhouse at risk by refusing to back HS2 to Leeds and Manchester	2015-04-02 12:22:33	50	1225696320	George Osborne	188335	123	2713	[]	['Northernpowerhouse']	[]
583605380787392513	Here @pulmansteel they're literally building the #NorthernPowerhouse- providing steel for new railways for the north http://t.co/Y3DMqe6btM	2015-04-02 12:22:20	19	1225696320	George Osborne	188335	123	2713	[]	['NorthernPowerhouse']	[]
583604761200611328	Visiting @pulmansteel again with @allott4Halifax - 5 yrs ago they were struggling, now growing+creating 50pc more jobs #Longtermeconomicplan	2015-04-02 12:19:52	22	1225696320	George Osborne	188335	123	2713	[]	['Longtermeconomicplan']	[]
583302856868007936	No ifs or buts. Britain now knows Miliband will cost jobs. 36 days left to save Britain's economic recovery	2015-04-01 16:20:12	64	1225696320	George Osborne	188335	123	2713	[]	[]	[]
583302745622495232	In Pudsey with @StuartAndrew.  Speaking @Britvic in W Yorks, whose chairman signed business letter http://t.co/MaxemJrWMO	2015-04-01 16:19:46	18	1225696320	George Osborne	188335	123	2713	[]	[]	[]
583271369565184000	On the Conservative campaign bus in West Yorkshire with the travelling pack http://t.co/wmmXpV9xtW	2015-04-01 14:15:05	51	1225696320	George Osborne	188335	123	2713	[]	[]	[]
583268113497636864	Thanks to brilliant @PaulUppalWSW for organising great visit to @MarstonsBeer in Wolverhampton http://t.co/j1bS3iRY9X	2015-04-01 14:02:09	20	1225696320	George Osborne	188335	123	2713	[]	[]	[]
583267885566558208	Been with @David_Cameron @MarstonsBeer. Their chief exec signed biz letter backing our plan, warning changing course risks recovery	2015-04-01 14:01:15	20	1225696320	George Osborne	188335	123	2713	[]	[]	[]
583169755277889536	Britain now knows: Vote for Ed Miliband and jobs, investment &amp; economic recovery are at risk. Britain should stick with plan that's working	2015-04-01 07:31:19	70	1225696320	George Osborne	188335	123	2713	[]	[]	[]
583169363018182656	Warning from Britain's business leaders couldn't be clearer: a change of course will threaten jobs, deter investment &amp; put recovery at risk	2015-04-01 07:29:45	48	1225696320	George Osborne	188335	123	2713	[]	[]	[]
583168747248218112	Business leaders' message is positive: under David Cameron's leadership, we have an economic plan that is working and creating jobs	2015-04-01 07:27:18	76	1225696320	George Osborne	188335	123	2713	[]	[]	[]
583168563306983424	Over 100 business leaders, heading up some of most famous brands from Prudential to Primark &amp; employing over 500,000 people, have spoken out	2015-04-01 07:26:34	55	1225696320	George Osborne	188335	123	2713	['people']	[]	[]
582854058119159808	With fantastic local #Hove candidate @Coxgraham @PizzaExpress being taught by apprentices how to make an American Hot http://t.co/oj5LwV8qFS	2015-03-31 10:36:51	35	1225696320	George Osborne	188335	123	2713	[]	['Hove']	[]
582853296727166976	Am at @PizzaExpress in #Hove-they're creating 2,500 new jobs in UK.Very welcome news on day we set goal of 2m more jobs in next parliament	2015-03-31 10:33:49	35	1225696320	George Osborne	188335	123	2713	[]	['Hove']	[]
582825517377798144	Consumer confidence at its highest level for over 12 years. #longtermeconomicplan delivering greater economic security to Britain's families	2015-03-31 08:43:26	51	1225696320	George Osborne	188335	123	2713	[]	['longtermeconomicplan']	[]
582825317947060224	Real household disposable income per capita up strongly on quarter &amp; year, higher than OBR forecast.Living standards higher than in May 2010	2015-03-31 08:42:38	52	1225696320	George Osborne	188335	123	2713	[]	[]	[]
582824980162953216	GDP revised upwards from 2.6% to 2.8% for 2014. Confirms UK as clearly fastest growing major advanced economy	2015-03-31 08:41:18	96	1225696320	George Osborne	188335	123	2713	[]	[]	[]
582823563167735810	Hat trick of good news just out from ONS: GDP revised up, consumer confidence up, living standards up. #LongTermEconomicPlan working	2015-03-31 08:35:40	206	1225696320	George Osborne	188335	123	2713	[]	['LongTermEconomicPlan']	[]
581803072608944128	We are offering a 7 day-a-week NHS. We can only afford a strong NHS because we have a strong economy	2015-03-28 13:00:36	75	1225696320	George Osborne	188335	123	2713	[]	[]	[]
581802513734746112	Powerful speech by PM. His message: to the homebuyer, the pensioner, and the family who want economic security - we're with you	2015-03-28 12:58:23	69	1225696320	George Osborne	188335	123	2713	[]	[]	[]
581802377541500928	Proud to introduce the PM onto stage. He is a patriot, a leader and someone I'm lucky to call my friend	2015-03-28 12:57:50	30	1225696320	George Osborne	188335	123	2713	[]	[]	[]
581802008484704256	Great atmosphere at Conservative Spring Forum here in the old Granada studios in Manchester, heart of #NorthernPowerhouse	2015-03-28 12:56:22	20	1225696320	George Osborne	188335	123	2713	[]	['NorthernPowerhouse']	[]
581752155759067136	With brilliant local MP Andrew Bingham @HighPeakAndrew for launch of his election campaign here @StreetCrane http://t.co/9e4H3hkdPH	2015-03-28 09:38:17	17	1225696320	George Osborne	188335	123	2713	[]	[]	[]
581750656882642944	Visiting @StreetCrane in High Peak - growing business who are expanding and creating jobs here #LongTermEconomicPlan	2015-03-28 09:32:19	8	1225696320	George Osborne	188335	123	2713	[]	['LongTermEconomicPlan']	[]
581526296125145089	Impressive plans for the 1st Knutsford Scouts’ new community building on the Moor. Let’s help them meet their £160k fundraising target	2015-03-27 18:40:47	14	1225696320	George Osborne	188335	123	2713	[]	[]	[]
581514111789490176	Newly restored Lion Salt Works museum at Marston in my constituency opens in may celebrating Cheshire’s salt-making heritage	2015-03-27 17:52:22	16	1225696320	George Osborne	188335	123	2713	[]	[]	[]
581512534836019201	Fantastic to see US firm @WatersCorp invest £60m in new mass spectrometry facility here in the north of England	2015-03-27 17:46:06	11	1225696320	George Osborne	188335	123	2713	[]	[]	[]
581495741891362816	Great to be at @WatersCorp in Wilmslow to show @speakerboehner our excellent science sector &amp; our plans for a #NorthernPowerhouse	2015-03-27 16:39:23	8	1225696320	George Osborne	188335	123	2713	[]	['NorthernPowerhouse']	[]
581495592297304064	Showing @SpeakerBoehner &amp; delegation how we are building the #NorthernPowerhouse here	2015-03-27 16:38:47	8	1225696320	George Osborne	188335	123	2713	[]	['NorthernPowerhouse']	[]
581494367631835136	Great to welcome @SpeakerBoehner &amp; Congressional delegation to my constituency. Working lunch @PeoverHall - Gen Patton's wartime HQ	2015-03-27 16:33:55	15	1225696320	George Osborne	188335	123	2713	[]	[]	[]
581418898836361216	With @GrahamEvans @FreightFirstUK. Great example of local biz growing@&amp; creating jobs –exactly what #longtermeconomicplan is here to support	2015-03-27 11:34:02	11	1225696320	George Osborne	188335	123	2713	[]	['longtermeconomicplan']	[]
581418489480642560	Great to hear how fuel cut and support for haulage companies announced in #Budget2015 will help @FreightFirstUK grow	2015-03-27 11:32:24	10	1225696320	George Osborne	188335	123	2713	[]	['Budget2015']	[]
581418433121804288	Driving to @FreightFirstUK in #Runcorn with Al, who's been telling me about life on the road http://t.co/IGtX1ukNGo	2015-03-27 11:32:11	15	1225696320	George Osborne	188335	123	2713	[]	['Runcorn']	[]
581147323796951040	With @NorwichChloe who has campaigned hard for new air ambulance - she's a good local champion &amp; huge supporter of @EastAngliAirAmb	2015-03-26 17:34:53	9	1225696320	George Osborne	188335	123	2713	[]	[]	[]
581146778671648768	At @EastAngliAirAmb in Norwich to see how £1.7m funding will help buy new helicopter to save more lives http://t.co/MMx155rbo0	2015-03-26 17:32:43	27	1225696320	George Osborne	188335	123	2713	[]	[]	[]
581115247374782464	We are donating £1.7m from #Libor fines to @EastAngliAirAmb; money from those who demonstrated worst values to those demonstrating best	2015-03-26 15:27:26	21	1225696320	George Osborne	188335	123	2713	[]	['Libor']	[]
581102115675906048	Excellent @pow_rebecca wanted me to visit @SheppysCider who've doubled in size over past 4 years &amp;now exporting cider from Somerset to China	2015-03-26 14:35:15	11	1225696320	George Osborne	188335	123	2713	[]	[]	[]
581101776708960256	Great visit to @SheppysCider to hear how cut to cider duty in #Budget2015 will help them &amp; whole industry grow http://t.co/HcDrXrCvQ8	2015-03-26 14:33:54	17	1225696320	George Osborne	188335	123	2713	[]	['Budget2015']	[]
581052911620349952	With our brilliant candidate for Wells @JSHeappey. He offers best of both worlds-strong local MP &amp; national #longtermeconomicplan that works	2015-03-26 11:19:44	6	1225696320	George Osborne	188335	123	2713	[]	['longtermeconomicplan']	[]
581052647874158592	Also announcing first 500 churches that will benefit from our roof repair fund which I extended at Budget.See list at http://t.co/yGo4tKmZMC	2015-03-26 11:18:41	24	1225696320	George Osborne	188335	123	2713	[]	[]	['http://www.lpowroof.org.uk']
581052368512520192	Visiting stunning @WellsCathedral1 to announce £160k to repair roof as part of our #WW1 Cathedral Repair fund	2015-03-26 11:17:34	14	1225696320	George Osborne	188335	123	2713	[]	['WW1']	[]
581052130615779328	Govt pushed industry to help customers compare bank accounts online - today's @Gocompare tool is good news for banking competition &amp; choice	2015-03-26 11:16:38	16	1225696320	George Osborne	188335	123	2713	[]	[]	[]
580996463976574976	We have raised a further £500m through Lloyds share sales. £9bn now recovered &amp; being used to pay down our national debt	2015-03-26 07:35:26	72	1225696320	George Osborne	188335	123	2713	[]	[]	[]
580431544260628480	Great to announce Pension Wise guidance booking line now open - ahead of #pensionfreedoms on April 6. https://t.co/DS6zXYLjus	2015-03-24 18:10:38	45	1225696320	George Osborne	188335	123	2713	[]	['pensionfreedoms']	['https://www.pensionwise.gov.uk']
580306955220205568	Prices are frozen &amp; as the recovery from Labour's Great Recession strengthens, their economic argument has literally come to nought	2015-03-24 09:55:34	113	1225696320	George Osborne	188335	123	2713	[]	[]	[]
580306814107062273	Inflation at zero is a first for the British economy. Low inflation due to falling oil prices is good news for family budgets	2015-03-24 09:55:00	88	1225696320	George Osborne	188335	123	2713	[]	[]	[]
580032223291826176	At Facebook offices answering questions following Sky's #Askthechancellors event here http://t.co/5b2rT2ROqv	2015-03-23 15:43:53	37	1225696320	George Osborne	188335	123	2713	[]	['Askthechancellors']	[]
579965862578376705	The @sciencemuseum will use over £20m proceeds to transform visitor experience &amp;  build new permanent galleries	2015-03-23 11:20:11	21	1225696320	George Osborne	188335	123	2713	[]	[]	[]
579965617295499265	Backing Britain's world leading science, research and innovation is key part of #longtermeconomicplan http://t.co/v0BsqliwPy	2015-03-23 11:19:13	19	1225696320	George Osborne	188335	123	2713	[]	['longtermeconomicplan']	[]
579965097885478912	With Britain's great modern inventor Sir James Dyson to launch new James Dyson School of Design Engineering at @Imperial College	2015-03-23 11:17:09	29	1225696320	George Osborne	188335	123	2713	[]	[]	[]
578982416091602944	Giving young people best opportunities is top priority. Great to meet apprentices @ManUtd &amp; hear about their plans to extend the programme	2015-03-20 18:12:19	14	1225696320	George Osborne	188335	123	2713	['people']	[]	[]
578982265264467968	Brilliant trip to @ManUtd with legend Sir Bobby Charlton hearing about his time here &amp; meeting young apprentices http://t.co/cSm6QpqnCv	2015-03-20 18:11:43	21	1225696320	George Osborne	188335	123	2713	[]	[]	[]
578981888041312256	Science is at heart of #NorthernPowerhouse - will benefit from huge investment incl £20m for Health North announced in #Budget2015	2015-03-20 18:10:13	15	1225696320	George Osborne	188335	123	2713	[]	['NorthernPowerhouse', 'Budget2015']	[]
578981780612599809	Fantastic to officially open National #Graphene Institute @officialUoM following nearly £40 million investment I announced in 2012	2015-03-20 18:09:48	25	1225696320	George Osborne	188335	123	2713	[]	['Graphene']	[]
578918873405251584	With Patrick McLoughlin visiting works on the A6 to Manchester Airport Relief Road - will hugely benefit the area http://t.co/9ut8dXVYEa	2015-03-20 13:59:49	10	1225696320	George Osborne	188335	123	2713	[]	[]	[]
578897306944147456	Electrification in the north is a key part of plans to build a #NorthernPowerhouse with faster more reliable journeys for millions of people	2015-03-20 12:34:08	12	1225696320	George Osborne	188335	123	2713	['people']	['NorthernPowerhouse']	[]
578897026513002496	Completion of the electrification of the historic Chat Moss line means refreshed electric trains operating between Liverpool &amp; @manairport	2015-03-20 12:33:01	5	1225696320	George Osborne	188335	123	2713	[]	[]	[]
578895826338074624	Excited to be in Manchester to give very special name to one of the electric trains for Liverpool &amp; @manairport route http://t.co/CKumI7Vn64	2015-03-20 12:28:15	48	1225696320	George Osborne	188335	123	2713	[]	[]	[]
578895085531721729	Will also make major investments in roads in the North inc expanding lanes on M62 between Leeds &amp; Manchester #NorthernPowerhouse	2015-03-20 12:25:18	15	1225696320	George Osborne	188335	123	2713	[]	['NorthernPowerhouse']	[]
578894437784395776	We will get HS2 to the north sooner than planned &amp; look at case to speed up construction of route btw Leeds &amp; Sheffield	2015-03-20 12:22:43	23	1225696320	George Osborne	188335	123	2713	[]	[]	[]
578893898547888129	Faster rail connections, new roads &amp; hassle-free smart tickets – all part of our plans to build a #NorthernPowerhouse	2015-03-20 12:20:35	34	1225696320	George Osborne	188335	123	2713	[]	['NorthernPowerhouse']	[]
578893778167164928	Launching Northern Transport Strategy with Transport for the North and Patrick McLoughlin in Manchester #NorthernPowerhouse	2015-03-20 12:20:06	12	1225696320	George Osborne	188335	123	2713	[]	['NorthernPowerhouse']	[]
578866142514675712	Really positive feedback on budget from FSB annual conference in Birmingham and lots of great ideas to back business for future	2015-03-20 10:30:17	41	1225696320	George Osborne	188335	123	2713	[]	[]	[]
578843439070081024	On train to West Midlands have just seen the solar eclipse underway - brilliant	2015-03-20 09:00:04	24	1225696320	George Osborne	188335	123	2713	[]	[]	[]
578599835357556737	V significant moment in economic debate. IFS confirm OBR forecast: living standards set to be higher in 2015 than in 2010. Plan is working	2015-03-19 16:52:05	100	1225696320	George Osborne	188335	123	2713	[]	[]	[]
578486462469009408	Getting Britain building is key to #LongTermEconomicPlan. In #Budget2015 I announced new support for first time buyers with @HelptoBuy ISA	2015-03-19 09:21:35	33	1225696320	George Osborne	188335	123	2713	[]	['LongTermEconomicPlan', 'Budget2015']	[]
578485999128444928	With great local MP @JackieDP at new @TravisperkinsUK site in Tilbury meeting the people building Britain's recovery http://t.co/0weEItRM9N	2015-03-19 09:19:44	11	1225696320	George Osborne	188335	123	2713	['people']	[]	[]
578468271105708032	Great to visit this @TravisPerkinsUK new depot. They're announcing 4,000 new jobs across UK - vote of confidence in #LongTermEconomicPlan	2015-03-19 08:09:17	23	1225696320	George Osborne	188335	123	2713	[]	['LongTermEconomicPlan']	[]
578458367204700160	Doing #Budget2015 interviews with @BBCBreakfast, @BBC5live, @GMB, @BBCr4today &amp; @SkyNews from @TravisPerkinsUK in Essex	2015-03-19 07:29:56	14	1225696320	George Osborne	188335	123	2713	[]	['Budget2015']	[]
578234171304189952	Growth up. Jobs up. Living standards rising. Deficit is down. National debt share falling. Britain is the comeback country #Budget15	2015-03-18 16:39:04	169	1225696320	George Osborne	188335	123	2713	[]	['Budget15']	[]
578233901522485248	New £1000 Personal Savings Allowance abolishes savings tax for 95% taxpayers	2015-03-18 16:37:59	61	1225696320	George Osborne	188335	123	2713	[]	[]	[]
578233767204106240	New @HelptoBuy ISA to help first time buyers save for deposit. For every £200 you save, govt will give you a bonus of £50 up to £3k bonus	2015-03-18 16:37:27	65	1225696320	George Osborne	188335	123	2713	[]	[]	[]
578233492930199552	Taking 4 major steps on #Savings: extending pension freedom, making ISAs more flexible + new @HelptoBuy ISA &amp; new Personal Savings Allowance	2015-03-18 16:36:22	24	1225696320	George Osborne	188335	123	2713	[]	['Savings']	[]
578233214508146688	Our tax cuts mean that typical taxpayer will be over £900 a year better off &amp; 3.7m of the lowest paid taken out of tax altogether.	2015-03-18 16:35:16	95	1225696320	George Osborne	188335	123	2713	[]	[]	[]
578233029119856640	Threshold at which people pay higher rate tax also rises above inflation	2015-03-18 16:34:31	9	1225696320	George Osborne	188335	123	2713	['people']	[]	[]
578232941245018112	#Budget15 raises personal allowance to £10.8k next yr &amp; £11k year after delivering tax cut for 27m	2015-03-18 16:34:10	36	1225696320	George Osborne	188335	123	2713	[]	['Budget15']	[]
578232764073451520	Am cancelling planned increase in #fuelduty - meaning longest duty freeze in 20 yrs and average £10 saving each time a family fills up car	2015-03-18 16:33:28	52	1225696320	George Osborne	188335	123	2713	[]	['fuelduty']	[]
578231618483187712	On #duties am cutting beer duty for 3rd year in a row – another penny off a pint &amp; cutting cider duty and Scotch whisky duty by 2% #Budget15	2015-03-18 16:28:55	19	1225696320	George Osborne	188335	123	2713	[]	['duties', 'Budget15']	[]
578228724140736512	We will also abolish the annual tax return altogether helping 12m people &amp; #smallbiz save time and money	2015-03-18 16:17:25	49	1225696320	George Osborne	188335	123	2713	['people']	['smallbiz']	[]
578228595363024896	To support 5m who are self-employed we will be abolishing Class 2 NICs for them entirely – making tax simpler for hardworking people	2015-03-18 16:16:54	46	1225696320	George Osborne	188335	123	2713	['people']	[]	[]
578228387300421632	We want to help local newspapers remain a vital part of community life so we will consult on how to provide them with tax support #Budget15	2015-03-18 16:16:05	21	1225696320	George Osborne	188335	123	2713	[]	['Budget15']	[]
578228145293279232	#Budget15 makes TV &amp; film tax credits more generous, expands support for video games and launches new tax credit for orchestras	2015-03-18 16:15:07	12	1225696320	George Osborne	188335	123	2713	[]	['Budget15']	[]
578227992725438464	Falling oil prices good for families but a danger to those whose jobs depend on North Sea- #Budget15 cuts tax for this vital industry	2015-03-18 16:14:31	9	1225696320	George Osborne	188335	123	2713	[]	['Budget15']	[]
578227859971547137	In #Scotland pushing ahead with #devolution, implementing #Glasgow City Deal &amp; opening negotiations on new deals for #Aberdeen &amp; #Inverness	2015-03-18 16:13:59	10	1225696320	George Osborne	188335	123	2713	[]	['Scotland', 'devolution', 'Glasgow', 'Aberdeen', 'Inverness']	[]
578227782079143936	Giving more power to #Wales - reducing toll on Severn Crossing &amp; working on new #Cardiff city deal.	2015-03-18 16:13:40	19	1225696320	George Osborne	188335	123	2713	[]	['Wales', 'Cardiff']	[]
578227494626701312	Also to connect up #SouthWest can confirm new rail franchise to bring intercity express trains and much improved rail services	2015-03-18 16:12:32	9	1225696320	George Osborne	188335	123	2713	[]	['SouthWest']	[]
578227289927843841	For #London announcing £97m for new station in Brent Cross, £7m for Croydon regeneration &amp; new powers for Mayor over skills &amp; planning	2015-03-18 16:11:43	10	1225696320	George Osborne	188335	123	2713	[]	['London']	[]
578227128107421697	To build #EngineForGrowth in #Midlands we are giving £60m to new Energy Research Accelerator and £100m for driverless technology	2015-03-18 16:11:04	9	1225696320	George Osborne	188335	123	2713	[]	['EngineForGrowth', 'Midlands']	[]
578226859118301184	For #Yorkshire we have agreed new city deal with West Yorkshire Combined Authority #NorthernPowerhouse	2015-03-18 16:10:00	8	1225696320	George Osborne	188335	123	2713	[]	['Yorkshire', 'NorthernPowerhouse']	[]
578226760640294913	We've reached provisional agreement to allow Greater Manchester to keep100% of additional growth in local business rates #NorthernPowerhouse	2015-03-18 16:09:37	12	1225696320	George Osborne	188335	123	2713	[]	['NorthernPowerhouse']	[]
578226267549470720	To build a #NorthernPowerhouse we are investing in #transport, giving £20m to Health North, and promoting industries from chemicals to tech	2015-03-18 16:07:39	13	1225696320	George Osborne	188335	123	2713	[]	['NorthernPowerhouse', 'transport']	[]
578225872337051649	Will use #libor funds to pay for new helicopters for Essex &amp; Herts, East Anglian, Welsh &amp; Scottish air ambulances &amp; the Lucy Air ambulance	2015-03-18 16:06:05	23	1225696320	George Osborne	188335	123	2713	[]	['libor']	[]
578225570737205249	On #charities I’m extending automatic gift-aid on donations from £5k to £8k helping over 6,500 small charities #Budget15	2015-03-18 16:04:53	15	1225696320	George Osborne	188335	123	2713	[]	['charities', 'Budget15']	[]
