tweet_id	text	created_at	retweet_count	user_id	screen_name	#followers	#followings	#statuses	keywords	hashtags	urls
657508223587655682	At @UoMGraphene in Manchester with President Xi Jinping to see great British discovery becoming British innovation https://t.co/AsE2HGIFL5	2015-10-23 10:45:51	35	1225696320	George Osborne	188335	123	2713	[]	[]	[]
657491124991492096	Pleased President Xi Jinping has come to Manchester to see the #NorthernPowerhouse in action https://t.co/7ATHr1P1dm	2015-10-23 09:37:54	47	1225696320	George Osborne	188335	123	2713	[]	['NorthernPowerhouse']	[]
657442010585026561	More evidence of unstoppable momentum for the #NorthernPowerhouse with landmark mayoral deals agreed in North East and Tees Valley today	2015-10-23 06:22:44	67	1225696320	George Osborne	188335	123	2713	[]	['NorthernPowerhouse']	[]
657176805120561152	Tax gap hits record low of 6.4% of tax collected. Proves Labour’s figures are wide of the mark. Another blow to their economic credibility	2015-10-22 12:48:54	53	1225696320	George Osborne	188335	123	2713	[]	[]	[]
656894903859941376	Mark Carney's impressive speech right to argue that we need safeguards for non-euro countries like Britain in the EU	2015-10-21 18:08:44	49	1225696320	George Osborne	188335	123	2713	[]	[]	[]
654599047601344512	Good #EUReform talks with Finnish FM @AlexStubb. Agreed better single market &amp; cutting red tape are priorities http://t.co/veWGU0xohS	2015-10-15 10:05:49	54	1225696320	George Osborne	188335	123	2713	[]	['EUReform']	[]
654401550417285121	Budget Responsibility Charter passed with good majority tonight means a Britain living within her means and security for working people	2015-10-14 21:01:02	118	1225696320	George Osborne	188335	123	2713	['people']	[]	[]
654217466273529856	Our plan's creating jobs &amp; increasing pay. Today we lock it in with vote in parliament on fiscal charter committing us to running a surplus	2015-10-14 08:49:33	33	1225696320	George Osborne	188335	123	2713	[]	[]	[]
654216829691383808	New stats show highest rate of employment in our history at 73.6%, youth unemployment rate at 7 year low &amp; pay rising strongly at 3%	2015-10-14 08:47:01	197	1225696320	George Osborne	188335	123	2713	[]	[]	[]
653949835373060096	Marking #AdaLovelaceDay, I want more women to follow her example and reach the top in science, technology, maths and engineering	2015-10-13 15:06:05	32	1225696320	George Osborne	188335	123	2713	[]	['AdaLovelaceDay']	[]
653851735006531584	We shouldn't mistake this for damaging deflation: we remain vigilant and our system is designed to deal with such risks	2015-10-13 08:36:16	35	1225696320	George Osborne	188335	123	2713	[]	[]	[]
653851466113921024	Inflation at -0.1% while wages rising at fastest rate in over a decade is a real boost for budgets of working families	2015-10-13 08:35:12	118	1225696320	George Osborne	188335	123	2713	[]	[]	[]
653820969631543296	We are making sure there is a special bonus for @RoyalMail employees who have done such a fantastic job of turning company around	2015-10-13 06:34:01	27	1225696320	George Osborne	188335	123	2713	[]	[]	[]
653820769189908480	Milestone moment in long &amp; proud history of Royal Mail, as we secure its long term future.Every penny will be used to pay down national debt	2015-10-13 06:33:13	29	1225696320	George Osborne	188335	123	2713	[]	[]	[]
653820550557601793	We’ve finished process of returning @RoyalMail to private sector. Right thing to do for Royal Mail workforce, customers and the taxpayer	2015-10-13 06:32:21	93	1225696320	George Osborne	188335	123	2713	[]	[]	[]
653583516173750273	Great that on 100th anniversary of her death @RoyalMintUK release individual coin to honour WWI hero Edith Cavell http://t.co/BBX3NizxJt	2015-10-12 14:50:27	54	1225696320	George Osborne	188335	123	2713	[]	[]	[]
653510212268204032	Merseyside’s @CammellLaird to build new £200m Polar Research Ship – keeping #NorthernPowerhouse at forefront of research + creating new jobs	2015-10-12 09:59:10	47	1225696320	George Osborne	188335	123	2713	[]	['NorthernPowerhouse']	[]
652816435689955328	I will miss Geoffrey Howe. He was a great source of advice to me;a quietly-spoken radical,whose bitterly contested budgets rescued Britain	2015-10-10 12:02:21	102	1225696320	George Osborne	188335	123	2713	[]	[]	[]
652532545041657856	Delighted to support @Lagarde for another term as head of #IMF. She is - in both the English and French meaning of the word - 'formidable'.	2015-10-09 17:14:16	38	1225696320	George Osborne	188335	123	2713	[]	['IMF']	[]
652524954773286912	Latest figures: 250,000 people have registered since I announced Lloyds retail sale at start of week. Huge boost for share-owning democracy	2015-10-09 16:44:07	42	1225696320	George Osborne	188335	123	2713	['people']	[]	[]
652524568876331010	Announcing today simpler @RBSGroup share structure as important step to returning bank to the private sector	2015-10-09 16:42:35	14	1225696320	George Osborne	188335	123	2713	[]	[]	[]
652516851222769664	Taxes should be paid where profits are made. Great to see @OECD #BEPS rules agreed here in Lima. UK will lead by example + implement early	2015-10-09 16:11:55	59	1225696320	George Osborne	188335	123	2713	[]	['BEPS']	[]
652171767331594240	Even my transport is flying the flag here in Lima http://t.co/64jDepCe5B	2015-10-08 17:20:40	54	1225696320	George Osborne	188335	123	2713	[]	[]	[]
652170897311203328	Arrived in Lima, Peru for IMF Annual Meeting. UK growth revised up, but world growth revised down. We must be prepared for global risks	2015-10-08 17:17:13	35	1225696320	George Osborne	188335	123	2713	[]	[]	[]
651849436642058240	Go Nadiya!! A brilliant Great British Bake Off final	2015-10-07 19:59:51	203	1225696320	George Osborne	188335	123	2713	[]	[]	[]
651739369422880768	Best speech I have ever heard @David_Cameron deliver: to fight inequality, poverty and discrimination join @Conservatives	2015-10-07 12:42:29	230	1225696320	George Osborne	188335	123	2713	[]	[]	[]
651417156417101824	Fantastic to open new @wellpharmacy HQ in Manchester. An expanding business helping to create jobs &amp; growth in the #NorthernPowerhouse	2015-10-06 15:22:07	27	1225696320	George Osborne	188335	123	2713	[]	['NorthernPowerhouse']	[]
651128672200486912	Great to host #NorthernPowerhouse reception at Granada Studios in Manchester with cultural, biz &amp; sporting figures http://t.co/ZxrOcTzkrh	2015-10-05 20:15:47	47	1225696320	George Osborne	188335	123	2713	[]	['NorthernPowerhouse']	[]
651041653625647104	Proud cities &amp; counties shouldn't be forced to come to gov with begging bowl so we’ll allow them to keep rates they collect from business	2015-10-05 14:30:00	60	1225696320	George Osborne	188335	123	2713	[]	[]	[]
651040741653938177	Have announced: We will create British Wealth Funds spread across the country to invest billions on infrastructure in the regions	2015-10-05 14:26:23	32	1225696320	George Osborne	188335	123	2713	[]	[]	[]
650952993869819904	At brand new Manchester Victoria seeing latest rail improvements.Delivering our plan to build the #NorthernPowerhouse http://t.co/nSuHFiiFjN	2015-10-05 08:37:42	50	1225696320	George Osborne	188335	123	2713	[]	['NorthernPowerhouse']	[]
650928120183287808	Next Spring we'll make Lloyds shares available to every member of the public. We'll build a share owning democracy.  https://t.co/DKYoOMS1br	2015-10-05 06:58:52	59	1225696320	George Osborne	188335	123	2713	[]	[]	['https://www.gov.uk/lloydsshares']
650923918149222401	Pleased former Labour cabinet minister Andrew Adonis will be National Infrastructure Commission chair.Working together in national interest	2015-10-05 06:42:10	71	1225696320	George Osborne	188335	123	2713	[]	[]	[]
650921734779092993	Just been interviewed on @GMB @BBCBreakfast, about to do @SkyNews @NickFerrariLBC &amp; @BBCr4today ahead of my speech at #CPC15	2015-10-05 06:33:29	15	1225696320	George Osborne	188335	123	2713	[]	['CPC15']	[]
650605645419401216	Grandparents shouldn't have to choose between helping with new grandchild and staying in work. So we'll introduce grandparental leave #CPC15	2015-10-04 09:37:28	99	1225696320	George Osborne	188335	123	2713	[]	['CPC15']	[]
650327041464774656	Sad to hear that Denis Healey has died at 98. A giant of the Labour movement + Chancellor in the most difficult circumstances	2015-10-03 15:10:23	160	1225696320	George Osborne	188335	123	2713	[]	[]	[]
649922527872053248	Deal today proves Manchester is not a one-off – Sheffield City Region is playing a vital part in helping to build the #NorthernPowerhouse	2015-10-02 12:23:00	24	1225696320	George Osborne	188335	123	2713	[]	['NorthernPowerhouse']	[]
649922381058809856	At impressive Advanced Manufacturing Park, near Orgeave. Committing to £30m over 30 years so we have long term investment in economy here	2015-10-02 12:22:25	22	1225696320	George Osborne	188335	123	2713	[]	[]	[]
649921855378296832	Sheffield City region forging ahead in the #NorthernPowerhouse with historic deal for elected mayor signed today http://t.co/8DWyYrYsA9	2015-10-02 12:20:19	43	1225696320	George Osborne	188335	123	2713	[]	['NorthernPowerhouse']	[]
649921493829308417	In S Yorkshire with civic leaders to sign historic deal for elected mayor here, with power for local people over skills,transport &amp; economy	2015-10-02 12:18:53	7	1225696320	George Osborne	188335	123	2713	['people']	[]	[]
649895523227451392	Meeting @NFL’s @NYJets &amp; @MiamiDolphins to discuss #NFL making a permanent home in London - global sporting capital http://t.co/uOlvp7mtVz	2015-10-02 10:35:41	56	1225696320	George Osborne	188335	123	2713	[]	['NFL']	[]
649876108423397376	Congratulations to @ZacGoldsmith, Conservative candidate for London 2016. Look forward to campaigning with him to keep London in safe hands	2015-10-02 09:18:33	58	1225696320	George Osborne	188335	123	2713	[]	[]	[]
649213957010554880	Connecting up great northern cities is crucial. New plan will deliver faster journey times &amp; more capacity between Manchester, Leeds &amp; York	2015-09-30 13:27:23	43	1225696320	George Osborne	188335	123	2713	[]	[]	[]
649213153834889216	Work on new proposals to electrify TransPennine lines resumes with immediate effect #NorthernPowerhouse	2015-09-30 13:24:12	45	1225696320	George Osborne	188335	123	2713	[]	['NorthernPowerhouse']	[]
649212411665367040	Latest figures show UK grew faster than thought: 11.8% since 2010, matching US + fastest growth in G7 in last 2 years	2015-09-30 13:21:15	76	1225696320	George Osborne	188335	123	2713	[]	[]	[]
647323578887733248	Delighted that we continue to get taxpayers’ money back through Lloyds share sales, taking total now to £15 billion	2015-09-25 08:15:42	44	1225696320	George Osborne	188335	123	2713	[]	[]	[]
647013381812174848	Visiting impressive Chengdu East Station where high speed rail is transforming the area http://t.co/g2Y1UNgXsP	2015-09-24 11:43:05	9	1225696320	George Osborne	188335	123	2713	[]	[]	[]
646991826793164801	Today we open bidding process for HS2 construction with contracts worth 11.8bn.  A milestone in a project key to Britain's future #UKChina	2015-09-24 10:17:26	45	1225696320	George Osborne	188335	123	2713	[]	['UKChina']	[]
646990375576596480	I want Chinese investment to create more jobs and more opportunities in the Northern Powerhouse #UKChina	2015-09-24 10:11:40	34	1225696320	George Osborne	188335	123	2713	[]	['UKChina']	[]
646990367481536512	With leaders of northern cities in Chengdu to showcase 24bn of investment opportunities in #NorthernPowerhouse #UKChina	2015-09-24 10:11:38	9	1225696320	George Osborne	188335	123	2713	[]	['NorthernPowerhouse', 'UKChina']	[]
646623279457923072	Great skills on display at football school in Xinjiang where we're announcing big expansion of UK training programme http://t.co/mj5cj3TkLi	2015-09-23 09:52:58	9	1225696320	George Osborne	188335	123	2713	[]	[]	[]
646622746772942848	Met workers at Urumqi haulage firm investing in North of England: #UKChina economic partnership in action http://t.co/NGESbKYTeJ	2015-09-23 09:50:51	18	1225696320	George Osborne	188335	123	2713	[]	['UKChina']	[]
646608767191252992	Am 1st UK minister ever to visit Urumqi: key staging post of China's new Silk Road. Many opportunities here for #UKChina	2015-09-23 08:55:18	21	1225696320	George Osborne	188335	123	2713	[]	['UKChina']	[]
646224925842407425	Delighted we have agreed with China to look into benefits of connecting UK and China stock markets #UKChina	2015-09-22 07:30:03	32	1225696320	George Osborne	188335	123	2713	[]	['UKChina']	[]
646224735026716672	Have chosen to speak at stock exchange with simple message: through ups &amp; downs UK &amp; China will stick together to benefit both our economies	2015-09-22 07:29:17	17	1225696320	George Osborne	188335	123	2713	[]	[]	[]
646221345852932096	At Shanghai Stock Exchange to set out my plans to cement UK's position as China’s best partner in the West #UKChina http://t.co/uFBMd6ocIN	2015-09-22 07:15:49	26	1225696320	George Osborne	188335	123	2713	[]	['UKChina']	[]
646220999030108160	Today am in Shanghai where I've been talking to Han Zheng, Shanghai's Party Secretary about stronger #UKChina financial links	2015-09-22 07:14:27	10	1225696320	George Osborne	188335	123	2713	[]	['UKChina']	[]
645840614097981440	Angel of the North looking over our discussions here in Beijing http://t.co/y6X02vD9Iu	2015-09-21 06:02:56	32	1225696320	George Osborne	188335	123	2713	[]	[]	[]
645840373349113856	Announcing  2bn guarantee for new Hinkley Point nuclear power station which with Chinese investment will supply 7% UK electricity #UKChina	2015-09-21 06:01:58	58	1225696320	George Osborne	188335	123	2713	[]	['UKChina']	[]
645838633514070017	China and Britain stand on brink of golden decade of cooperation. No economy in world as open to Chinese investment as UK #UKChina	2015-09-21 05:55:03	57	1225696320	George Osborne	188335	123	2713	[]	['UKChina']	[]
645838497731862528	Great welcome from Chinese leaders for ambitious UK delegation: ministers, business, cultural+Northern Powerhouse leaders taking in 7 cities	2015-09-21 05:54:31	11	1225696320	George Osborne	188335	123	2713	[]	[]	[]
645837992326631424	Delighted to open economic and financial talks in Beijing with Vice Premier Ma Kai. UK can be China's best partner in the West #UKChina	2015-09-21 05:52:31	21	1225696320	George Osborne	188335	123	2713	[]	['UKChina']	[]
645756489332690944	Seen fantastic performance in mandarin  of Warhorse &amp; Richard III at National Theatre in Beijing http://t.co/NqVYAy5utZ	2015-09-21 00:28:39	28	1225696320	George Osborne	188335	123	2713	[]	[]	[]
645755890063114241	Great to bring UK cultural leaders from orgs like @BritishMuseum, @Tate &amp; @The_Globe - promoting best of British culture here in #China	2015-09-21 00:26:16	31	1225696320	George Osborne	188335	123	2713	[]	['China']	[]
645565254999498753	Brilliant event at Tech Temple in Beijing. Big role for Britain to be part of this new Chinese economy http://t.co/FYSnrFUoOq	2015-09-20 11:48:45	16	1225696320	George Osborne	188335	123	2713	[]	[]	[]
645564931190841344	With Jim O'Neill meeting up &amp; coming Chinese entrepreneurs to set out why we want to see a golden decade for #UKChina relations	2015-09-20 11:47:28	15	1225696320	George Osborne	188335	123	2713	[]	['UKChina']	[]
645560663931142144	Great to bring #NorthernPowerhouse leaders @SirRichardLeese Julie Dore @SeanAnstee @cllrJudithBlake John Mothersole &amp;Michael Jones to #China	2015-09-20 11:30:30	37	1225696320	George Osborne	188335	123	2713	[]	['NorthernPowerhouse', 'China']	[]
645560179828764672	Will be developing better economic &amp; cultural links &amp; promoting Britain in cities the length &amp; breadth of China	2015-09-20 11:28:35	24	1225696320	George Osborne	188335	123	2713	[]	[]	[]
645559722339233792	In Beijing with @SajidJavid, @AmberRudd_MP, @GregClarkMP, @Anna_Soubry, @HBaldwinMP, &amp; Jim O'Neill for Economic Dialogue	2015-09-20 11:26:46	21	1225696320	George Osborne	188335	123	2713	[]	[]	[]
644982499576291329	RT @TheGlobalGoals: @George_Osborne Stephen Hawking believes we can make a difference in the world.  #GlobalGoals https://t.co/3ULhah8BzI	2015-09-18 21:13:05	25	1225696320	George Osborne	188335	123	2713	[]	['GlobalGoals']	['https://amp.twimg.com/v/b507cd56-8fb4-4b1b-9a46-8ed8df8687d4']
644906152711557120	Joined parishioners to open the fantastic café at St. John’s church in Knutsford: a great community space and great coffee too	2015-09-18 16:09:43	8	1225696320	George Osborne	188335	123	2713	[]	[]	[]
644894803822575616	Chinese investment has already supported the #NorthernPowerhouse – but we can go even further to create more jobs #UKChina	2015-09-18 15:24:37	14	1225696320	George Osborne	188335	123	2713	[]	['NorthernPowerhouse', 'UKChina']	[]
644894414075240448	Tomorrow I’ll begin a five day tour of China to help us forge closer economic and cultural links. Vital for growth in both nations #UKChina	2015-09-18 15:23:04	24	1225696320	George Osborne	188335	123	2713	[]	['UKChina']	[]
644864448549781504	Good meeting with Ian Cass new MD of @The_FPB. Supporting small and medium sized business is key to our economic plan	2015-09-18 13:24:00	6	1225696320	George Osborne	188335	123	2713	[]	[]	[]
644758709747470336	This huge science investment means UK can protect our own citizens + lead world work on health threats like Ebola http://t.co/wsS79Sr8X3	2015-09-18 06:23:50	22	1225696320	George Osborne	188335	123	2713	[]	[]	[]
644473681444491264	This huge science investment means UK can protect our own citizens + lead world work on health threats like Ebola http://t.co/pJ7Wc4Ehcj	2015-09-17 11:31:14	32	1225696320	George Osborne	188335	123	2713	[]	[]	[]
644472695619461120	In Harlow with @Halfon4HarlowMP to announce crucial £350m to build new world-class public health labs for Public Health England	2015-09-17 11:27:19	31	1225696320	George Osborne	188335	123	2713	[]	[]	[]
644451929448423424	I am @GIC2015 discussing how the UK is welcoming the world’s investors. The message is clear: Britain is open for business	2015-09-17 10:04:47	22	1225696320	George Osborne	188335	123	2713	[]	[]	[]
644072861431373824	This government will continue to support firms, improve skills and is introducing a new National Minimum Wage	2015-09-16 08:58:31	24	1225696320	George Osborne	188335	123	2713	[]	[]	[]
644072698147143680	At 73.5%, employment rate at record high. But we still face risks from global economy &amp; those at home who'd undermine our economic security	2015-09-16 08:57:52	62	1225696320	George Osborne	188335	123	2713	[]	[]	[]
644072143643365376	With wages up 2.9% over the year and inflation low, working people have received the fastest real terms rise in over a decade	2015-09-16 08:55:39	82	1225696320	George Osborne	188335	123	2713	['people']	[]	[]
643796916459995136	Today we see inflation at zero while wage rises go from strength to strength. National Living Wage will help further	2015-09-15 14:42:00	81	1225696320	George Osborne	188335	123	2713	[]	[]	[]
642604336846123008	In Luxembourg this am at informal ECOFIN to discuss crucial issue of economic governance + long term relationship between euro ins/outs	2015-09-12 07:43:07	26	1225696320	George Osborne	188335	123	2713	[]	[]	[]
642373832590913537	Pleased to announce I am waiving VAT on charity single #helpiscoming in support of @savethechildrenuk's refugee fund http://t.co/zNtYb39as8	2015-09-11 16:27:11	128	1225696320	George Osborne	188335	123	2713	[]	['helpiscoming']	['http://www.helpiscoming.org']
642327648350437376	Thank you to everyone who took part in the Public Sector Efficiency Challenge - over 20k public sector employees gave us their ideas	2015-09-11 13:23:39	24	1225696320	George Osborne	188335	123	2713	[]	[]	[]
641937730948173824	The #BattleofBritain bunker at RAF Uxbridge is an incredible piece of history and definitely worth visiting http://t.co/798UWVO3NT	2015-09-10 11:34:16	50	1225696320	George Osborne	188335	123	2713	[]	['BattleofBritain']	[]
641935867293122560	Brilliant visit to Uxbridge with @MayorofLondon on eve 75th anniversary of #BattleofBritain. In Budget gave £1m to restore historic bunker	2015-09-10 11:26:52	11	1225696320	George Osborne	188335	123	2713	[]	['BattleofBritain']	[]
641886578198061056	Enjoyed day with @JasonCowleyNS talking Northern Powerhouse, standing up for working people - &amp; Labour leadership http://t.co/fYskHrC11m	2015-09-10 08:11:00	8	1225696320	George Osborne	188335	123	2713	['people']	[]	['http://www.newstatesman.com/politics/uk/2015/09/ascent-submarine-george-osborne-talks-jason-cowley']
641668556829130753	We will now give first-time buyers a boost with #HelptoBuyISA launching In December. 6 major lenders have already signed up to offer it	2015-09-09 17:44:40	29	1225696320	George Osborne	188335	123	2713	[]	['HelptoBuyISA']	[]
641665387889852416	#HelptoBuy mortgage guarantee helped when market faltered. Stronger economy allows banks to lend w/out govt support. Equity Loan thriving	2015-09-09 17:32:04	7	1225696320	George Osborne	188335	123	2713	[]	['HelptoBuy']	[]
641664695095664640	We're committed to helping people achieve the aspiration of buying their own home. #HelptoBuy has now helped nearly 120,000 do just that	2015-09-09 17:29:19	10	1225696320	George Osborne	188335	123	2713	['people']	['HelptoBuy']	[]
640083527422357504	With global growth revised down + and risks on the rise, it's all the more reason we in UK go on putting our own house in order	2015-09-05 08:46:19	36	1225696320	George Osborne	188335	123	2713	[]	[]	[]
640081716963622912	In Ankara where #G20 focussed on risks from emerging markets, and Asian stock markets. UK economy cited as source of stability and growth	2015-09-05 08:39:08	25	1225696320	George Osborne	188335	123	2713	[]	['G20']	[]
639453645663260673	The @HitachiRailEU and @NissanUK investments huge vote of confidence in #NorthernPowerhouse and economic plan	2015-09-03 15:03:24	18	1225696320	George Osborne	188335	123	2713	[]	['NorthernPowerhouse']	[]
639453424766033920	In Newton Aycliffe @HitachiRailEU to welcome the return of train building to the #NorthEast. Will create 700 jobs &amp; support thousands more	2015-09-03 15:02:31	16	1225696320	George Osborne	188335	123	2713	[]	['NorthEast']	[]
639413029604601856	@NissanUK are a vital employer in the #NorthernPowerhouse &amp; today's news shows Britain continuing to lead the way as a global car producer	2015-09-03 12:22:00	3	1225696320	George Osborne	188335	123	2713	[]	['NorthernPowerhouse']	[]
639412351301775360	Thrilled to be in #Sunderland to welcome @NissanUK £100m investment, securing 1k jobs. Great news for North East	2015-09-03 12:19:18	25	1225696320	George Osborne	188335	123	2713	[]	['Sunderland']	[]
639033015948193792	We helped @65degnorth with £100k from #Libor. Only right that fines from those demonstrating worst of values go to those demonstrating best	2015-09-02 11:11:58	16	1225696320	George Osborne	188335	123	2713	[]	['Libor']	[]
639032160041717761	V good to meet @PeteBowker &amp; @65degnorth team to hear inspiring stories re 1st amputee crossing of Greenland icecap http://t.co/6I20ru8t3h	2015-09-02 11:08:34	17	1225696320	George Osborne	188335	123	2713	[]	[]	[]
638378532721328129	Today's investments in defence on Clyde and oil&amp;gas in Aberdeen are a double dividend - an example of UK Government delivering for Scotland	2015-08-31 15:51:17	59	1225696320	George Osborne	188335	123	2713	[]	[]	[]
638378269495177216	@maerksoil told me their investment today only possible because of help provided to oil &amp; gas industry in Budget. #longtermeconomicplan	2015-08-31 15:50:14	22	1225696320	George Osborne	188335	123	2713	[]	['longtermeconomicplan']	[]
638378118449905664	In Aberdeen for news today of £3bn investment by @maerskoil in new Culzean gas field – supporting 6000 jobs	2015-08-31 15:49:38	44	1225696320	George Osborne	188335	123	2713	[]	[]	[]
638310515169730561	Economic and national security go hand in hand - our long term plan means we can afford to keep our defences strong	2015-08-31 11:21:00	63	1225696320	George Osborne	188335	123	2713	[]	[]	[]
638310413143285760	In a dangerous world Britain needs the ultimate insurance policy with nuclear deterrent. We'll continue to invest in national security.	2015-08-31 11:20:36	121	1225696320	George Osborne	188335	123	2713	[]	[]	[]
638310306595405824	Great to be in #Faslane today - announcing £500m of investment in the base which will create thousands of jobs	2015-08-31 11:20:10	102	1225696320	George Osborne	188335	123	2713	[]	['Faslane']	[]
638022468628824069	Great weekend seeing some fun shows at the @edfringe + spectacular @EdinburghTattoo. A brilliant atmosphere in the city.	2015-08-30 16:16:25	22	1225696320	George Osborne	188335	123	2713	[]	[]	[]
636871318080778241	Britain deserves a pay rise so great @sainsburysstaff will be paid at least National Living Wage early with biggest increases in 10 years	2015-08-27 12:02:09	41	1225696320	George Osborne	188335	123	2713	[]	[]	[]
636167288664813568	Each poppy represents a British &amp; Commonwealth soldier who gave so much for this country. Now a chance for all to see this moving tribute	2015-08-25 13:24:35	17	1225696320	George Osborne	188335	123	2713	[]	[]	[]
636166607673380864	Wonderful to visit @ysculpture nr Wakefield to see brilliant #seaofpoppies which will tour country with gov support http://t.co/RTRLSOFzJf	2015-08-25 13:21:53	29	1225696320	George Osborne	188335	123	2713	[]	['seaofpoppies']	[]
636112715921100800	In Yorkshire announcing £1m #LIBOR fines for @YorkshireAirAmb. Money from those who show worst of values going to those who demonstrate best	2015-08-25 09:47:44	48	1225696320	George Osborne	188335	123	2713	[]	['LIBOR']	[]
